{
  "group": "group-a",
  "pr": 12,
  "sha": "4f1c2e9",
  "reportedAt": "2026-10-27T14:42:10+01:00",
  "schemaVersion": 1,
  "facts": {
    "phase": "Spec reviewed",
    "draft": true,
    "specReviewedAt": "2026-10-27T14:35:00+01:00",
    "ci": { "result": "pass", "at": "2026-10-27T14:41:02+01:00" },
    "firstGreenAt": null,
    "artifacts": {
      "agentsMd": {
        "present": true,
        "firstSeenAt": "2026-10-27T13:22:00+01:00",
        "lastChangedAt": "2026-10-27T14:02:00+01:00"
      },
      "glossary": {
        "present": true,
        "firstSeenAt": "2026-10-27T13:40:00+01:00",
        "lastChangedAt": "2026-10-27T14:10:00+01:00"
      },
      "spec": {
        "present": true,
        "firstSeenAt": "2026-10-27T13:55:00+01:00",
        "lastChangedAt": "2026-10-27T14:30:00+01:00"
      },
      "tickets": {
        "present": false,
        "firstSeenAt": null,
        "lastChangedAt": null
      },
      "review": {
        "present": false,
        "firstSeenAt": null,
        "lastChangedAt": null
      },
      "howWeWorked": {
        "present": true,
        "firstSeenAt": "2026-10-27T14:05:00+01:00",
        "lastChangedAt": "2026-10-27T14:40:00+01:00"
      }
    },
    "skillsWritten": [],
    "areasTouched": {
      "api": false,
      "web": false,
      "apiTests": false,
      "webTests": false,
      "agentContext": true,
      "workingOut": true
    },
    "testsAdded": [],
    "review": {
      "rounds": 0,
      "findings": { "actOn": 0, "consider": 0, "noted": 0, "dismissed": 0 }
    },
    "lastPushAt": "2026-10-27T14:40:30+01:00"
  },
  "judgements": {
    "now": "Turning the reviewed spec into tickets, starting with join-by-code",
    "notable": "The group wrote its glossary before writing the spec",
    "decisions": {
      "join": {
        "call": "in",
        "line": "Six-character code, no accounts",
        "evidence": [
          {
            "file": "work/group-a/spec.md",
            "quote": "Colleagues join with a six-character code."
          }
        ]
      },
      "deadline": {
        "call": "in",
        "line": "Host sets it; latecomers are locked out",
        "evidence": [
          {
            "file": "work/group-a/spec.md",
            "quote": "After the deadline nobody can add dishes."
          }
        ]
      },
      "multipleRestaurants": {
        "call": "out",
        "line": "One restaurant per group order",
        "evidence": [
          {
            "file": "work/group-a/spec.md",
            "quote": "A group order has exactly one restaurant."
          }
        ]
      },
      "editRights": {
        "call": "in",
        "line": "Own dishes only; host can remove anyone's",
        "evidence": [
          {
            "file": "work/group-a/spec.md",
            "quote": "The host can remove any line."
          }
        ]
      },
      "splitBill": {
        "call": "out",
        "line": "No payments in the app",
        "evidence": [
          {
            "file": "work/group-a/spec.md",
            "quote": "Out: splitting the bill."
          }
        ]
      },
      "minimumOrderAndFee": {
        "call": "open",
        "line": "Fee share per person still under discussion",
        "evidence": [
          {
            "file": "work/group-a/spec.md",
            "quote": "TBD: show each person's share?"
          }
        ]
      },
      "kitchenPerPerson": {
        "call": "in",
        "line": "Kitchen view groups lines per person",
        "evidence": [
          {
            "file": "work/group-a/spec.md",
            "quote": "Kitchen sees the order grouped per person."
          }
        ]
      }
    },
    "acceptanceExamples": [
      {
        "example": "A colleague joins with the code and sees the shared basket",
        "test": null,
        "evidence": []
      },
      {
        "example": "After the deadline adding a dish is refused",
        "test": null,
        "evidence": []
      },
      {
        "example": "The host removes a colleague's dish",
        "test": null,
        "evidence": []
      }
    ],
    "slices": [],
    "reviewHeadline": null,
    "agentGotWrong": [
      {
        "item": "Assumed colleagues need an account to join",
        "twice": false,
        "evidence": []
      }
    ]
  }
}
